Evaluating original_config_refit
Evaluating original_if_refit
[I 2026-09-29 20:20:21,030] A new study created in RDB with name: risk
[I 2026-09-29 20:20:24,366] Trial 0 finished with value: 0.8010312170903456 and parameters: {'n_estimators': 350, 'max_depth': 6, 'learning_rate': 0.10604793157329842, 'min_child_weight': 12.019949436760623, 'gamma': 0.6240745617697461, 'subsample': 0.662397808134481, 'colsample_bytree': 0.6703292642588699, 'colsample_bylevel': 0.9665440364437338, 'reg_alpha': 0.026652406046810753, 'reg_lambda': 5.675206026988746, 'max_delta_step': 0.10292247147901223, 'max_bin': 128, 'weighting': 'none', 'critical_weight': 1.9127267288786132, 'calibration': 'none', 'feature_set': 'displacement_health'}. Best is trial 0 with value: 0.8010312170903456.
[I 2026-09-29 20:20:26,324] Trial 1 finished with value: 0.9327652463820606 and parameters: {'n_estimators': 250, 'max_depth': 3, 'learning_rate': 0.06150970254013887, 'min_child_weight': 21.016842677383526, 'gamma': 0.7986951286334389, 'subsample': 0.8056937753654446, 'colsample_bytree': 0.8573450991017149, 'colsample_bylevel': 0.7616126031799995, 'reg_alpha': 0.028998790688889834, 'reg_lambda': 0.26448980183927095, 'max_delta_step': 0.3252579649263976, 'max_bin': 256, 'weighting': 'none', 'critical_weight': 3.052699079536471, 'calibration': 'isotonic', 'feature_set': 'displacement_physics'}. Best is trial 1 with value: 0.9327652463820606.
[I 2026-09-29 20:20:29,058] Trial 2 finished with value: 0.9429119419455319 and parameters: {'n_estimators': 250, 'max_depth': 5, 'learning_rate': 0.046257274856204685, 'min_child_weight': 9.498479527360814, 'gamma': 2.1868411173731186, 'subsample': 0.6739417822102108, 'colsample_bytree': 0.9893546197175955, 'colsample_bylevel': 0.9437832058402786, 'reg_alpha': 2.2603530975217483, 'reg_lambda': 16.466293382966793, 'max_delta_step': 2.9894998940554256, 'max_bin': 128, 'weighting': 'inverse', 'critical_weight': 2.166031869068446, 'calibration': 'sigmoid', 'feature_set': 'displacement_physics'}. Best is trial 2 with value: 0.9429119419455319.
[I 2026-09-29 20:20:30,838] Trial 3 finished with value: 0.8065784352511256 and parameters: {'n_estimators': 150, 'max_depth': 6, 'learning_rate': 0.02896374385821842, 'min_child_weight': 38.45913414908674, 'gamma': 3.0889790771866297, 'subsample': 0.6794862726136689, 'colsample_bytree': 0.6519327409932608, 'colsample_bylevel': 0.9538653571137086, 'reg_alpha': 0.10674776722523947, 'reg_lambda': 6.394979414183315, 'max_delta_step': 3.8563517334297286, 'max_bin': 256, 'weighting': 'sqrt', 'critical_weight': 1.9926940745579476, 'calibration': 'isotonic', 'feature_set': 'displacement_health'}. Best is trial 2 with value: 0.9429119419455319.
[I 2026-09-29 20:20:35,406] Trial 4 finished with value: 0.8027392341895074 and parameters: {'n_estimators': 650, 'max_depth': 4, 'learning_rate': 0.031657166624657056, 'min_child_weight': 16.942709250653106, 'gamma': 3.0431401944675898, 'subsample': 0.8245108790277985, 'colsample_bytree': 0.9198385129840964, 'colsample_bylevel': 0.8734488990910977, 'reg_alpha': 0.009528811042709534, 'reg_lambda': 1.1457000811140412, 'max_delta_step': 0.12709563372047594, 'max_bin': 128, 'weighting': 'none', 'critical_weight': 3.722699421778279, 'calibration': 'isotonic', 'feature_set': 'displacement_health'}. Best is trial 2 with value: 0.9429119419455319.
[I 2026-09-29 20:20:36,364] Trial 5 pruned. 
[I 2026-09-29 20:20:37,718] Trial 6 finished with value: 0.950346247218037 and parameters: {'n_estimators': 150, 'max_depth': 3, 'learning_rate': 0.16081521623804476, 'min_child_weight': 5.266555981229908, 'gamma': 2.0751624869734644, 'subsample': 0.8812075835580712, 'colsample_bytree': 0.7772703608327529, 'colsample_bylevel': 0.9929455206802402, 'reg_alpha': 3.0546275517175463, 'reg_lambda': 0.42043152838347025, 'max_delta_step': 2.4862425294619275, 'max_bin': 128, 'weighting': 'sqrt', 'critical_weight': 1.1544362537499682, 'calibration': 'sigmoid', 'feature_set': 'displacement_physics'}. Best is trial 6 with value: 0.950346247218037.
[I 2026-09-29 20:20:40,849] Trial 7 pruned. 
[I 2026-09-29 20:20:45,938] Trial 8 finished with value: 0.9474984592181074 and parameters: {'n_estimators': 550, 'max_depth': 3, 'learning_rate': 0.15886530774967705, 'min_child_weight': 3.019596192118852, 'gamma': 1.364265404201034, 'subsample': 0.6453894084962356, 'colsample_bytree': 0.973642766397497, 'colsample_bylevel': 0.9693348383452453, 'reg_alpha': 0.00029512200940308783, 'reg_lambda': 4.313804987283086, 'max_delta_step': 4.0861110010060795, 'max_bin': 128, 'weighting': 'inverse', 'critical_weight': 3.7012541714899916, 'calibration': 'none', 'feature_set': 'displacement_physics'}. Best is trial 6 with value: 0.950346247218037.
[I 2026-09-29 20:20:51,040] Trial 9 pruned. 
[I 2026-09-29 20:20:53,118] Trial 10 finished with value: 0.9524724465450282 and parameters: {'n_estimators': 150, 'max_depth': 6, 'learning_rate': 0.05362300146084949, 'min_child_weight': 4.449799631552483, 'gamma': 3.5209444856875844, 'subsample': 0.9022750545029153, 'colsample_bytree': 0.7451432311265443, 'colsample_bylevel': 0.9584982771312303, 'reg_alpha': 0.9749506108988133, 'reg_lambda': 0.7335650819199291, 'max_delta_step': 4.6095611478255964, 'max_bin': 128, 'weighting': 'sqrt', 'critical_weight': 1.105644074916389, 'calibration': 'sigmoid', 'feature_set': 'displacement_physics'}. Best is trial 10 with value: 0.9524724465450282.
[I 2026-09-29 20:20:55,199] Trial 11 finished with value: 0.9577258670991751 and parameters: {'n_estimators': 150, 'max_depth': 6, 'learning_rate': 0.09152625689496835, 'min_child_weight': 3.9049394944930804, 'gamma': 1.9318382050290115, 'subsample': 0.9231363439846648, 'colsample_bytree': 0.8150039351048834, 'colsample_bylevel': 0.9702022720879208, 'reg_alpha': 0.009915894462785287, 'reg_lambda': 2.5657925400099844, 'max_delta_step': 3.2160904006190445, 'max_bin': 128, 'weighting': 'sqrt', 'critical_weight': 1.538022581397366, 'calibration': 'sigmoid', 'feature_set': 'displacement_physics'}. Best is trial 11 with value: 0.9577258670991751.
[I 2026-09-29 20:20:58,244] Trial 12 finished with value: 0.9478630032562829 and parameters: {'n_estimators': 350, 'max_depth': 6, 'learning_rate': 0.07122887197902142, 'min_child_weight': 4.039111641438262, 'gamma': 2.268700672002822, 'subsample': 0.9859552837977923, 'colsample_bytree': 0.7035017625465741, 'colsample_bylevel': 0.9708768935693244, 'reg_alpha': 0.012957521672075981, 'reg_lambda': 0.5306070369999196, 'max_delta_step': 4.692164329906378, 'max_bin': 128, 'weighting': 'sqrt', 'critical_weight': 2.4361144006752147, 'calibration': 'sigmoid', 'feature_set': 'displacement_physics'}. Best is trial 11 with value: 0.9577258670991751.
[I 2026-09-29 20:21:00,179] Trial 13 finished with value: 0.955536407776816 and parameters: {'n_estimators': 150, 'max_depth': 6, 'learning_rate': 0.10292033368559253, 'min_child_weight': 3.277436507405401, 'gamma': 2.629746525243538, 'subsample': 0.8849153884522573, 'colsample_bytree': 0.8066932158663763, 'colsample_bylevel': 0.8864346044881002, 'reg_alpha': 0.0029959972866419266, 'reg_lambda': 2.5897030560180263, 'max_delta_step': 2.627540643683309, 'max_bin': 128, 'weighting': 'sqrt', 'critical_weight': 1.1011746396164983, 'calibration': 'sigmoid', 'feature_set': 'displacement_physics'}. Best is trial 11 with value: 0.9577258670991751.
[I 2026-09-29 20:21:01,858] Trial 14 finished with value: 0.948940984627579 and parameters: {'n_estimators': 150, 'max_depth': 6, 'learning_rate': 0.12711471236921099, 'min_child_weight': 3.725232022663, 'gamma': 3.5827916148134764, 'subsample': 0.9274649039551571, 'colsample_bytree': 0.8988707588621255, 'colsample_bylevel': 0.972934975788208, 'reg_alpha': 0.17799872573826223, 'reg_lambda': 4.166657242183408, 'max_delta_step': 3.225231144400076, 'max_bin': 128, 'weighting': 'sqrt', 'critical_weight': 1.4679957214534416, 'calibration': 'sigmoid', 'feature_set': 'displacement_physics'}. Best is trial 11 with value: 0.9577258670991751.
[I 2026-09-29 20:21:04,077] Trial 15 finished with value: 0.9622022311209532 and parameters: {'n_estimators': 250, 'max_depth': 6, 'learning_rate': 0.11549300012384892, 'min_child_weight': 5.413127860165442, 'gamma': 2.3582754174375777, 'subsample': 0.8828228497738542, 'colsample_bytree': 0.8699165695041238, 'colsample_bylevel': 0.8991202431491853, 'reg_alpha': 0.00040586389695981666, 'reg_lambda': 0.6318412049604699, 'max_delta_step': 4.027861336679006, 'max_bin': 128, 'weighting': 'none', 'critical_weight': 1.4690072263568765, 'calibration': 'sigmoid', 'feature_set': 'displacement_physics'}. Best is trial 15 with value: 0.9622022311209532.
[I 2026-09-29 20:21:06,497] Trial 16 finished with value: 0.948004188979095 and parameters: {'n_estimators': 250, 'max_depth': 6, 'learning_rate': 0.12792398689327558, 'min_child_weight': 7.293683340835441, 'gamma': 2.1465489932247737, 'subsample': 0.8433528478399113, 'colsample_bytree': 0.8895153415519391, 'colsample_bylevel': 0.9914758009464343, 'reg_alpha': 0.0011455311714300706, 'reg_lambda': 0.7459167107543077, 'max_delta_step': 4.121296945910693, 'max_bin': 128, 'weighting': 'sqrt', 'critical_weight': 1.549498156249438, 'calibration': 'sigmoid', 'feature_set': 'displacement_physics'}. Best is trial 15 with value: 0.9622022311209532.
[I 2026-09-29 20:21:09,016] Trial 17 finished with value: 0.9587237053808175 and parameters: {'n_estimators': 350, 'max_depth': 6, 'learning_rate': 0.13105149840980368, 'min_child_weight': 8.562787051016226, 'gamma': 2.55224118996422, 'subsample': 0.9553332117114502, 'colsample_bytree': 0.898899118502184, 'colsample_bylevel': 0.9012583147208728, 'reg_alpha': 0.001015267241985617, 'reg_lambda': 0.23822997033417287, 'max_delta_step': 2.9877892789422145, 'max_bin': 128, 'weighting': 'none', 'critical_weight': 2.146663251564668, 'calibration': 'sigmoid', 'feature_set': 'displacement_physics'}. Best is trial 15 with value: 0.9622022311209532.
[I 2026-09-29 20:21:11,383] Trial 18 finished with value: 0.9528651279809007 and parameters: {'n_estimators': 350, 'max_depth': 6, 'learning_rate': 0.16546820461180942, 'min_child_weight': 10.794981451922396, 'gamma': 2.812381797686699, 'subsample': 0.8933415535186628, 'colsample_bytree': 0.79426820431355, 'colsample_bylevel': 0.9058000263396627, 'reg_alpha': 0.00025010667844140537, 'reg_lambda': 1.5498735512943214, 'max_delta_step': 2.8134261392008275, 'max_bin': 128, 'weighting': 'none', 'critical_weight': 2.005163463696358, 'calibration': 'isotonic', 'feature_set': 'displacement_physics'}. Best is trial 15 with value: 0.9622022311209532.
[I 2026-09-29 20:21:13,884] Trial 19 finished with value: 0.9547283905656737 and parameters: {'n_estimators': 250, 'max_depth': 6, 'learning_rate': 0.09078828407139028, 'min_child_weight': 7.5413191463568205, 'gamma': 1.7400454093230442, 'subsample': 0.9266124716830456, 'colsample_bytree': 0.8445460272584682, 'colsample_bylevel': 0.8911885087001034, 'reg_alpha': 8.300716324742898e-05, 'reg_lambda': 0.6936238634512488, 'max_delta_step': 1.8356658725036743, 'max_bin': 128, 'weighting': 'none', 'critical_weight': 2.888002911609518, 'calibration': 'sigmoid', 'feature_set': 'displacement_physics'}. Best is trial 15 with value: 0.9622022311209532.
[I 2026-09-29 20:21:13,901] A new study created in RDB with name: if
[I 2026-09-29 20:21:14,335] Trial 0 finished with value: 0.4728923630061689 and parameters: {'n_estimators': 150, 'max_samples': 128, 'max_features': 0.5779972601681014, 'bootstrap': True, 'feature_set': 'displacement_physics'}. Best is trial 0 with value: 0.4728923630061689.
[I 2026-09-29 20:21:14,638] Trial 1 finished with value: 0.47681148768272863 and parameters: {'n_estimators': 100, 'max_samples': 128, 'max_features': 0.5917022549267169, 'bootstrap': True, 'feature_set': 'displacement_health'}. Best is trial 1 with value: 0.47681148768272863.
[I 2026-09-29 20:21:15,509] Trial 2 finished with value: 0.5128362783489768 and parameters: {'n_estimators': 250, 'max_samples': 1024, 'max_features': 0.8925879806965068, 'bootstrap': True, 'feature_set': 'displacement_health'}. Best is trial 2 with value: 0.5128362783489768.
[I 2026-09-29 20:21:16,450] Trial 3 finished with value: 0.5122378075992098 and parameters: {'n_estimators': 250, 'max_samples': 1024, 'max_features': 0.9041986740582306, 'bootstrap': False, 'feature_set': 'displacement_health'}. Best is trial 2 with value: 0.5128362783489768.
[I 2026-09-29 20:21:16,792] Trial 4 finished with value: 0.5063378347207582 and parameters: {'n_estimators': 100, 'max_samples': 512, 'max_features': 0.831261142176991, 'bootstrap': True, 'feature_set': 'displacement_health'}. Best is trial 2 with value: 0.5128362783489768.
[I 2026-09-29 20:21:17,360] Trial 5 pruned. 
[I 2026-09-29 20:21:17,654] Trial 6 pruned. 
[I 2026-09-29 20:21:18,237] Trial 7 pruned. 
[I 2026-09-29 20:21:18,858] Trial 8 pruned. 
[I 2026-09-29 20:21:19,264] Trial 9 finished with value: 0.5151207175903935 and parameters: {'n_estimators': 100, 'max_samples': 1024, 'max_features': 0.7468977981821954, 'bootstrap': False, 'feature_set': 'displacement_physics'}. Best is trial 9 with value: 0.5151207175903935.
[I 2026-09-29 20:21:19,676] Trial 10 finished with value: 0.5205853092404744 and parameters: {'n_estimators': 100, 'max_samples': 1024, 'max_features': 0.5208761718993881, 'bootstrap': False, 'feature_set': 'displacement_physics'}. Best is trial 10 with value: 0.5205853092404744.
[I 2026-09-29 20:21:20,108] Trial 11 finished with value: 0.5205853092404744 and parameters: {'n_estimators': 100, 'max_samples': 1024, 'max_features': 0.511318638639258, 'bootstrap': False, 'feature_set': 'displacement_physics'}. Best is trial 10 with value: 0.5205853092404744.
[I 2026-09-29 20:21:20,699] Trial 12 finished with value: 0.5239065293646615 and parameters: {'n_estimators': 150, 'max_samples': 1024, 'max_features': 0.5019474065380636, 'bootstrap': False, 'feature_set': 'displacement_physics'}. Best is trial 12 with value: 0.5239065293646615.
[I 2026-09-29 20:21:21,234] Trial 13 pruned. 
[I 2026-09-29 20:21:21,666] Trial 14 pruned. 
[I 2026-09-29 20:21:21,918] Trial 15 pruned. 
[I 2026-09-29 20:21:22,332] Trial 16 pruned. 
[I 2026-09-29 20:21:22,875] Trial 17 finished with value: 0.5214478012994 and parameters: {'n_estimators': 150, 'max_samples': 1024, 'max_features': 0.5155285471343724, 'bootstrap': True, 'feature_set': 'displacement_physics'}. Best is trial 12 with value: 0.5239065293646615.
[I 2026-09-29 20:21:23,430] Trial 18 finished with value: 0.5214478012994 and parameters: {'n_estimators': 150, 'max_samples': 1024, 'max_features': 0.5110916071376792, 'bootstrap': True, 'feature_set': 'displacement_physics'}. Best is trial 12 with value: 0.5239065293646615.
[I 2026-09-29 20:21:23,676] Trial 19 pruned. 
Evaluating optimized_risk
Evaluating optimized_if
Evaluating ablation_displacement_health
[
  {
    "experiment": "original_config_refit",
    "scope": "reserved_development_validation",
    "critical_recall": 0.946236559139785,
    "macro_pr_auc": 0.9283825324586049,
    "macro_f1": 0.7381223841520773,
    "normal_fpr": 0.05235649274578715,
    "normal_critical_fpr": 0.049202487158691535,
    "brier": 0.1291293054819107,
    "ece": 0.024750157985953328,
    "rows": 14481,
    "confusion_matrix": [
      [
        10516,
        35,
        546
      ],
      [
        928,
        1634,
        264
      ],
      [
        18,
        12,
        528
      ]
    ]
  },
  {
    "experiment": "optimized_risk",
    "scope": "reserved_development_validation",
    "critical_recall": 0.9265232974910395,
    "macro_pr_auc": 0.9354411407896053,
    "macro_f1": 0.7361756696443725,
    "normal_fpr": 0.05235649274578715,
    "normal_critical_fpr": 0.05001351716680184,
    "brier": 0.11891313735800609,
    "ece": 0.035105370634926164,
    "rows": 14481,
    "confusion_matrix": [
      [
        10516,
        26,
        555
      ],
      [
        769,
        1709,
        348
      ],
      [
        28,
        13,
        517
      ]
    ]
  },
  {
    "experiment": "original_if_refit",
    "scope": "reserved_development_validation",
    "anomaly_recall": 0.5015822784810127,
    "anomaly_fpr": 0.06836851868209522,
    "anomaly_pr_auc": 0.6089668717741478,
    "anomaly_macro_f1": 0.7370894651375431,
    "rows": 14481
  },
  {
    "experiment": "optimized_if",
    "scope": "reserved_development_validation",
    "anomaly_recall": 0.5022151898734177,
    "anomaly_fpr": 0.06960515855489798,
    "anomaly_pr_auc": 0.6015000257164264,
    "anomaly_macro_f1": 0.7363302922310822,
    "rows": 14481
  }
]
