[I 2026-09-29 20:46:55,013] Trial 19 finished with value: 1.288580471696024 and parameters: {'model': 'two_stage', 'n_estimators': 450, 'max_depth': 3, 'learning_rate': 0.06679427801909746, 'critical_weight': 2.6192884805761754, 'weight_power': 0.5, 'calibration': 'none', 'feature_set': 'full', 'alpha': 1.0}. Best is trial 6 with value: 1.2897053572085737.
/Users/harshkumarjha/mine/.venv/lib/python3.12/site-packages/numpy/lib/_nanfunctions_impl.py:1214: RuntimeWarning: Mean of empty slice
  return np.nanmean(a, axis, out=out, keepdims=keepdims)
/Users/harshkumarjha/mine/.venv/lib/python3.12/site-packages/numpy/lib/_nanfunctions_impl.py:1214: RuntimeWarning: Mean of empty slice
  return np.nanmean(a, axis, out=out, keepdims=keepdims)
/Users/harshkumarjha/mine/.venv/lib/python3.12/site-packages/numpy/lib/_nanfunctions_impl.py:1214: RuntimeWarning: Mean of empty slice
  return np.nanmean(a, axis, out=out, keepdims=keepdims)
/Users/harshkumarjha/mine/.venv/lib/python3.12/site-packages/numpy/lib/_nanfunctions_impl.py:1214: RuntimeWarning: Mean of empty slice
  return np.nanmean(a, axis, out=out, keepdims=keepdims)
/Users/harshkumarjha/mine/.venv/lib/python3.12/site-packages/numpy/lib/_nanfunctions_impl.py:1214: RuntimeWarning: Mean of empty slice
  return np.nanmean(a, axis, out=out, keepdims=keepdims)
/Users/harshkumarjha/mine/.venv/lib/python3.12/site-packages/numpy/lib/_nanfunctions_impl.py:1214: RuntimeWarning: Mean of empty slice
  return np.nanmean(a, axis, out=out, keepdims=keepdims)
/Users/harshkumarjha/mine/.venv/lib/python3.12/site-packages/numpy/lib/_nanfunctions_impl.py:1214: RuntimeWarning: Mean of empty slice
  return np.nanmean(a, axis, out=out, keepdims=keepdims)
/Users/harshkumarjha/mine/.venv/lib/python3.12/site-packages/numpy/lib/_nanfunctions_impl.py:1214: RuntimeWarning: Mean of empty slice
  return np.nanmean(a, axis, out=out, keepdims=keepdims)
/Users/harshkumarjha/mine/.venv/lib/python3.12/site-packages/numpy/lib/_nanfunctions_impl.py:1214: RuntimeWarning: Mean of empty slice
  return np.nanmean(a, axis, out=out, keepdims=keepdims)
/Users/harshkumarjha/mine/.venv/lib/python3.12/site-packages/numpy/lib/_nanfunctions_impl.py:1214: RuntimeWarning: Mean of empty slice
  return np.nanmean(a, axis, out=out, keepdims=keepdims)
/Users/harshkumarjha/mine/.venv/lib/python3.12/site-packages/numpy/lib/_nanfunctions_impl.py:1214: RuntimeWarning: Mean of empty slice
  return np.nanmean(a, axis, out=out, keepdims=keepdims)
/Users/harshkumarjha/mine/.venv/lib/python3.12/site-packages/numpy/lib/_nanfunctions_impl.py:1214: RuntimeWarning: Mean of empty slice
  return np.nanmean(a, axis, out=out, keepdims=keepdims)
/Users/harshkumarjha/mine/.venv/lib/python3.12/site-packages/numpy/lib/_nanfunctions_impl.py:1214: RuntimeWarning: Mean of empty slice
  return np.nanmean(a, axis, out=out, keepdims=keepdims)
/Users/harshkumarjha/mine/.venv/lib/python3.12/site-packages/numpy/lib/_nanfunctions_impl.py:1214: RuntimeWarning: Mean of empty slice
  return np.nanmean(a, axis, out=out, keepdims=keepdims)
/Users/harshkumarjha/mine/.venv/lib/python3.12/site-packages/numpy/lib/_nanfunctions_impl.py:1214: RuntimeWarning: Mean of empty slice
  return np.nanmean(a, axis, out=out, keepdims=keepdims)
/Users/harshkumarjha/mine/.venv/lib/python3.12/site-packages/numpy/lib/_nanfunctions_impl.py:1214: RuntimeWarning: Mean of empty slice
  return np.nanmean(a, axis, out=out, keepdims=keepdims)
/Users/harshkumarjha/mine/.venv/lib/python3.12/site-packages/numpy/lib/_nanfunctions_impl.py:1214: RuntimeWarning: Mean of empty slice
  return np.nanmean(a, axis, out=out, keepdims=keepdims)
/Users/harshkumarjha/mine/.venv/lib/python3.12/site-packages/numpy/lib/_nanfunctions_impl.py:1214: RuntimeWarning: Mean of empty slice
  return np.nanmean(a, axis, out=out, keepdims=keepdims)
/Users/harshkumarjha/mine/.venv/lib/python3.12/site-packages/numpy/lib/_nanfunctions_impl.py:1214: RuntimeWarning: Mean of empty slice
  return np.nanmean(a, axis, out=out, keepdims=keepdims)
/Users/harshkumarjha/mine/.venv/lib/python3.12/site-packages/numpy/lib/_nanfunctions_impl.py:1214: RuntimeWarning: Mean of empty slice
  return np.nanmean(a, axis, out=out, keepdims=keepdims)
/Users/harshkumarjha/mine/.venv/lib/python3.12/site-packages/numpy/lib/_nanfunctions_impl.py:1214: RuntimeWarning: Mean of empty slice
  return np.nanmean(a, axis, out=out, keepdims=keepdims)
{
  "selected": {
    "model": "selected",
    "scope": "reserved_noisy_development_validation",
    "target": "local_severity_v1",
    "critical_recall": 1.0,
    "macro_pr_auc": 0.9991617325006498,
    "macro_f1": 0.9611770215681453,
    "normal_fpr": 0.0254149377593361,
    "normal_critical_fpr": 0.0254149377593361,
    "brier": 0.005934213288128376,
    "ece": 0.001960033421508093,
    "rows": 4608,
    "confusion_matrix": [
      [
        3758,
        0,
        98
      ],
      [
        4,
        90,
        2
      ],
      [
        0,
        0,
        656
      ]
    ]
  },
  "confidence_interval": {
    "unit": "generation_parameter_id (whole events and repeat noise realizations)",
    "groups": 256,
    "replicates": 500,
    "critical_recall_95pct": [
      1.0,
      1.0
    ],
    "normal_fpr_95pct": [
      0.012045059718982483,
      0.03948903540551633
    ]
  },
  "winner": "ablation_movement"
}
